Item Name,Sub-Concept,Typical Price (Est),POS Category Group,Toast Category to Assign,Notes
The OG (Smash Burger),Wavy Burgers,$10.00 - $12.00,Food - Wavy Burgers,Food - Wavy Burgers,Two Wagyu beef blend patties American cheese caramelized onions sriracha aioli
Chili Crisp OG,Wavy Burgers,$11.00 - $13.00,Food - Wavy Burgers,Food - Wavy Burgers,The OG burger with added garlic chili crisp topping
Bacon Heirloom Burger,Wavy Burgers,$11.00 - $13.00,Food - Wavy Burgers,Food - Wavy Burgers,Seasonal heirloom tomato bacon and cheese burger
Prosciutto Sando,Wavy Burgers,$10.00 - $12.00,Food - Wavy Burgers,Food - Wavy Burgers,Premium prosciutto sandwich offered alongside smash burgers
Crispy Tater Tots,Wavy Burgers,$4.00 - $6.00,Sides - Wavy Burgers,Sides - Wavy Burgers,Signature side dish; high-margin item
Breakfast Biscuit Sandwiches,Wavy Burgers,$6.00 - $8.00,Breakfast - Wavy Burgers,Food - Wavy Burgers,Breakfast egg/sausage and cheese on house biscuits
